{"document_id": "25853b3cccbd", "file_name": "ASC300N1200ME3.pdf", "pdf_path": "/Users/qclaw/Projects/datasheet-extractor-rebuild-github/tests/sample_datasheets/ASC300N1200ME3.pdf", "pages": [{"page_number": 1, "tables": [{"page_number": 1, "table_index": 0, "flavor": "lattice", "rows": [{"row_index": 0, "cells": ["Symbol", "Parameter", "Values", "", "", "Unit", "Test Conditions"]}, {"row_index": 1, "cells": ["Absolute maximum rating", "", "", "", "", "", ""]}, {"row_index": 2, "cells": ["VDS", "Drain-Source Voltage", "1200", "", "", "V", "TC=25\uf0b0C"]}, {"row_index": 3, "cells": ["ID", "Drain Current (continuous)", "300", "", "", "A", "TC=25\uf0b0C"]}, {"row_index": 4, "cells": ["", "", "240", "", "", "", "TC=75\uf0b0C"]}, {"row_index": 5, "cells": ["TJ; MAX", "Junction Temperature", "175", "", "", "\uf0b0C", ""]}, {"row_index": 6, "cells": ["Symbol", "Parameter", "Min.", "Typ.", "Max.", "Unit", "Test Conditions"]}, {"row_index": 7, "cells": ["Static characteristics", "", "", "", "", "", ""]}, {"row_index": 8, "cells": ["RDS(on)", "Static Drain-Source on Resistance", "-", "5.3", "6.7", "m\u03a9", "VGS=18V; ID=150A; TC=25\uf0b0C"]}, {"row_index": 9, "cells": ["Dynamic characteristics", "", "", "", "", "", ""]}, {"row_index": 10, "cells": ["QG", "Total Gate Charge", "-", "618", "-", "nC", "VDD=800V; VGS=-5/+18V; ID=150A; TC=25\uf0b0C"]}, {"row_index": 11, "cells": ["QGD", "Gate-Drain Charge", "-", "147", "-", "", ""]}, {"row_index": 12, "cells": ["Source-drain diode", "", "", "", "", "", ""]}, {"row_index": 13, "cells": ["QRR", "Reverse Recovery Charge", "-", "1839", "-", "nC", "VGS=-5/+18V; IF=150A; VR=800V; RG(ext)=5\u03a9; Load=50\u00b5H; TJ=25\uf0b0C"]}], "accuracy": 96.35, "whitespace": 40.82, "score": 100.0, "table_bbox": [35.74558645707376, 65.28, 561.1337363966143, 323.76]}, {"page_number": 1, "table_index": 1, "flavor": "stream", "rows": [{"row_index": 0, "cells": ["Key Parameters", "", "", "", "", "", "", ""]}, {"row_index": 1, "cells": ["Symbol", "Parameter", "", "Values", "", "Unit", "", "Test Conditions"]}, {"row_index": 2, "cells": ["Absolute maximum rating", "", "", "", "", "", "", ""]}, {"row_index": 3, "cells": ["VDS", "Drain-Source Voltage", "", "1200", "", "V", "TC=25\uf0b0C", ""]}, {"row_index": 4, "cells": ["", "", "", "300", "", "", "TC=25\uf0b0C", ""]}, {"row_index": 5, "cells": ["ID", "Drain Current (continuous)", "", "", "", "A", "", ""]}, {"row_index": 6, "cells": ["", "", "", "240", "", "", "TC=75\uf0b0C", ""]}, {"row_index": 7, "cells": ["TJ; MAX", "Junction Temperature", "", "175", "", "\uf0b0C", "", ""]}, {"row_index": 8, "cells": ["Symbol", "Parameter", "Min.", "Typ.", "Max.", "Unit", "", "Test Conditions"]}, {"row_index": 9, "cells": ["Static characteristics", "", "", "", "", "", "", ""]}, {"row_index": 10, "cells": ["RDS(on)", "Static Drain-Source on Resistance", "-", "5.3", "6.7", "m\u03a9", "VGS=18V; ID=150A; TC=25\uf0b0C", ""]}, {"row_index": 11, "cells": ["Dynamic characteristics", "", "", "", "", "", "", ""]}, {"row_index": 12, "cells": ["QG", "Total Gate Charge", "-", "618", "-", "", "", ""]}, {"row_index": 13, "cells": ["", "", "", "", "", "", "", "VDD=800V; VGS=-5/+18V; ID=150A;"]}, {"row_index": 14, "cells": ["", "", "", "", "", "nC", "", ""]}, {"row_index": 15, "cells": ["", "", "", "", "", "", "TC=25\uf0b0C", ""]}, {"row_index": 16, "cells": ["QGD", "Gate-Drain Charge", "-", "147", "-", "", "", ""]}, {"row_index": 17, "cells": ["Source-drain diode", "", "", "", "", "", "", ""]}, {"row_index": 18, "cells": ["", "", "", "", "", "", "", "VGS=-5/+18V; IF=150A; VR=800V;"]}, {"row_index": 19, "cells": ["QRR", "Reverse Recovery Charge", "-", "1839", "-", "nC", "", ""]}, {"row_index": 20, "cells": ["", "", "", "", "", "", "", "RG(ext)=5\u03a9; Load=50\u00b5H; TJ=25\uf0b0C"]}], "accuracy": 92.94, "whitespace": 63.69, "score": 95.0, "table_bbox": [31.304000000000002, 62.2688, 549.87572, 365.02637714285714]}, {"page_number": 1, "table_index": 2, "flavor": "lattice", "rows": [{"row_index": 0, "cells": ["Order Number", "ASC300N1200ME3-X"]}, {"row_index": 1, "cells": ["Marking", "ASC300N1200ME3"]}, {"row_index": 2, "cells": ["Package Type", "ME3"]}], "accuracy": 100.0, "whitespace": 0.0, "score": 85.0, "table_bbox": [334.665054413543, 398.88, 562.0933494558647, 460.79999999999995]}]}, {"page_number": 2, "tables": [{"page_number": 2, "table_index": 0, "flavor": "lattice", "rows": [{"row_index": 0, "cells": ["Symbol", "Parameter", "Min.", "Typ.", "Max.", "Unit", "Test Conditions"]}, {"row_index": 1, "cells": ["Static characteristics (at TC=25\u2103 unless otherwise specified)", "", "", "", "", "", ""]}, {"row_index": 2, "cells": ["BVDS", "Drain-Source Breakdown Voltage", "1200", "-", "-", "V", "VGS=0V"]}, {"row_index": 3, "cells": ["IDSS", "Zero Gate Voltage Drain Current", "-", "-", "150", "\u03bcA", "VDS=1200V; VGS=0V"]}, {"row_index": 4, "cells": ["IGSS", "Gate-Body Leakage Current", "-", "-", "1.5", "\u03bcA", "VGS=-10/20V; VDS=0V"]}, {"row_index": 5, "cells": ["VGS(th)", "Gate Threshold Voltage", "2", "-", "4", "V", "VDS=VGS; ID=30mA"]}, {"row_index": 6, "cells": ["RDS(on)", "Static Drain-Source on Resistance", "-", "5.3", "6.7", "m\u03a9", "VGS=18V; ID=150A"]}, {"row_index": 7, "cells": ["VGS(on)", "Recommended Turn-on Voltage", "-", "18", "-", "V", "Static"]}, {"row_index": 8, "cells": ["VGS(off)", "Recommended Turn-off Voltage", "-", "-5", "-", "", ""]}, {"row_index": 9, "cells": ["RG", "Gate Resistance", "-", "2.3", "-", "\u03a9", "VGS=0V; f=1MHz"]}, {"row_index": 10, "cells": ["Dynamic characteristics (at TC=25\u2103 unless otherwise specified)", "", "", "", "", "", ""]}, {"row_index": 11, "cells": ["Ciss", "Input Capacitance", "-", "9.15", "-", "nF", "VDS=1000V; f=1MHz; VAC=25mV"]}, {"row_index": 12, "cells": ["Coss", "Output Capacitance", "-", "0.29", "-", "", ""]}, {"row_index": 13, "cells": ["Crss", "Reverse Transfer Capacitance", "-", "45", "-", "pF", ""]}, {"row_index": 14, "cells": ["Eon", "Turn-on Energy", "-", "7.1", "-", "mJ", "VDS=800V; VGS=-5/+18V; ID=150A; RG(ext)=5\u03a9; Load=50\u00b5H"]}, {"row_index": 15, "cells": ["Eoff", "Turn-off Energy", "-", "7.9", "-", "", ""]}, {"row_index": 16, "cells": ["QGS", "Gate-Source Charge", "-", "174", "-", "nC", "VDD=800V; VGS=-5/+18V; ID=150A"]}, {"row_index": 17, "cells": ["QGD", "Gate-Drain Charge", "-", "147", "-", "", ""]}, {"row_index": 18, "cells": ["QG", "Total Gate Charge", "-", "618", "-", "", ""]}, {"row_index": 19, "cells": ["td(on)", "Turn-on Delay Time", "-", "186", "-", "ns", "VDS=800V; VGS=-5/+18V; ID=150A; RG(ext)=5\u03a9; Load=50\u00b5H"]}, {"row_index": 20, "cells": ["tr", "Rise Time", "-", "42", "-", "", ""]}, {"row_index": 21, "cells": ["td(off)", "Turn-off Delay Time", "-", "387", "-", "", ""]}, {"row_index": 22, "cells": ["tf", "Fall Time", "-", "86", "-", "", ""]}], "accuracy": 99.45, "whitespace": 18.01, "score": 111.99, "table_bbox": [35.98548972188634, 126.24, 561.1337363966143, 532.3199999999999]}, {"page_number": 2, "table_index": 1, "flavor": "stream", "rows": [{"row_index": 0, "cells": ["Symbol", "Parameter", "Min.", "Typ.", "Max.", "Unit", "Test Conditions"]}, {"row_index": 1, "cells": ["Static characteristics (at TC=25\u2103 unless otherwise specified)", "", "", "", "", "", ""]}, {"row_index": 2, "cells": ["BVDS", "Drain-Source Breakdown Voltage", "1200", "-", "-", "V", "VGS=0V"]}, {"row_index": 3, "cells": ["IDSS", "Zero Gate Voltage Drain Current", "-", "-", "150", "\u03bcA", "VDS=1200V; VGS=0V"]}, {"row_index": 4, "cells": ["IGSS", "Gate-Body Leakage Current", "-", "-", "1.5", "\u03bcA", "VGS=-10/20V; VDS=0V"]}, {"row_index": 5, "cells": ["VGS(th)", "Gate Threshold Voltage", "2", "-", "4", "V", "VDS=VGS; ID=30mA"]}, {"row_index": 6, "cells": ["RDS(on)", "Static Drain-Source on Resistance", "-", "5.3", "6.7", "m\u03a9", "VGS=18V; ID=150A"]}, {"row_index": 7, "cells": ["VGS(on)", "Recommended Turn-on Voltage", "-", "18", "-", "", ""]}, {"row_index": 8, "cells": ["", "", "", "", "", "V", "Static"]}, {"row_index": 9, "cells": ["VGS(off)", "Recommended Turn-off Voltage", "-", "-5", "-", "", ""]}, {"row_index": 10, "cells": ["RG", "Gate Resistance", "-", "2.3", "-", "\u03a9", "VGS=0V; f=1MHz"]}, {"row_index": 11, "cells": ["Dynamic characteristics (at TC=25\u2103 unless otherwise specified)", "", "", "", "", "", ""]}, {"row_index": 12, "cells": ["Ciss", "Input Capacitance", "-", "9.15", "-", "", ""]}, {"row_index": 13, "cells": ["", "", "", "", "", "nF", ""]}, {"row_index": 14, "cells": ["Coss", "Output Capacitance", "-", "0.29", "-", "", "VDS=1000V; f=1MHz; VAC=25mV"]}, {"row_index": 15, "cells": ["Crss", "Reverse Transfer Capacitance", "-", "45", "-", "pF", ""]}, {"row_index": 16, "cells": ["Eon", "Turn-on Energy", "-", "7.1", "-", "", ""]}, {"row_index": 17, "cells": ["", "", "", "", "", "", "VDS=800V; VGS=-5/+18V; ID=150A;"]}, {"row_index": 18, "cells": ["", "", "", "", "", "mJ", ""]}, {"row_index": 19, "cells": ["", "", "", "", "", "", "RG(ext)=5\u03a9; Load=50\u00b5H"]}, {"row_index": 20, "cells": ["Eoff", "Turn-off Energy", "-", "7.9", "-", "", ""]}, {"row_index": 21, "cells": ["QGS", "Gate-Source Charge", "-", "174", "-", "", ""]}, {"row_index": 22, "cells": ["QGD", "Gate-Drain Charge", "-", "147", "-", "nC", "VDD=800V; VGS=-5/+18V; ID=150A"]}, {"row_index": 23, "cells": ["QG", "Total Gate Charge", "-", "618", "-", "", ""]}, {"row_index": 24, "cells": ["td(on)", "Turn-on Delay Time", "-", "186", "-", "", ""]}, {"row_index": 25, "cells": ["tr", "Rise Time", "-", "42", "-", "", ""]}, {"row_index": 26, "cells": ["", "", "", "", "", "", "VDS=800V; VGS=-5/+18V; ID=150A;"]}, {"row_index": 27, "cells": ["", "", "", "", "", "ns", ""]}, {"row_index": 28, "cells": ["", "", "", "", "", "", "RG(ext)=5\u03a9; Load=50\u00b5H"]}, {"row_index": 29, "cells": ["td(off)", "Turn-off Delay Time", "-", "387", "-", "", ""]}, {"row_index": 30, "cells": ["tf", "Fall Time", "-", "86", "-", "", ""]}], "accuracy": 98.74, "whitespace": 38.25, "score": 110.0, "table_bbox": [31.784, 119.8948, 550.3557199999999, 5